{
  "id": "orbital_elements_nearretrograde_012",
  "category": "orbital_elements",
  "case_version": "0.1.0",
  "generated_by": {
    "tool": "GMAT",
    "tool_version": "R2026a",
    "tool_sha256": "fe124b4a606b2e3b704a6fbb1c37b87598d5df0d18cb661c304b5f60074a7754",
    "kernel": "none (two-body conversion)",
    "date": "2026-10-25",
    "method": "GMAT parameters of a Cartesian state entered in EarthMJ2000Eq with the case numbers, Earth.Mu = gm_km3_s2, one Report per parameter; an output derived from several parameters (sources.py) is their closed formula evaluated at 60 digits from GMAT's printed decimals and rounded once",
    "reference_frame": "EarthMJ2000Eq (axes of the input numbers; the conversion does not depend on them)",
    "script": "orbital_elements_nearretrograde_012.script",
    "log": "orbital_elements_nearretrograde_012.log"
  },
  "outputs": {
    "semi_major_axis_km": 7500.000000000005,
    "eccentricity": 0.10000000000000003,
    "inclination_deg": 179.9899999999809,
    "raan_deg": 39.999999999999986,
    "argp_deg": 60.0000000000003,
    "true_anomaly_deg": 109.9999999999997,
    "eccentric_anomaly_deg": 104.51247870602432,
    "mean_anomaly_deg": 98.96571390550812,
    "argument_of_latitude_deg": 170.0,
    "longitude_of_periapsis_deg": 100.00000000000028,
    "true_longitude_deg": 209.99999999999997,
    "mean_longitude_deg": 198.9657139055084,
    "periapsis_radius_km": 6750.000000000004,
    "apoapsis_radius_km": 8250.000000000005,
    "semi_latus_rectum_km": 7425.000000000005,
    "period_s": 6464.022790934755,
    "specific_energy_km2_s2": -26.573362367134823,
    "angular_momentum_km2_s": [
      6.103261464253739,
      -7.273583776566195,
      -54402.28068275101
    ],
    "periapsis_speed_km_s": 8.059597260940016,
    "apoapsis_speed_km_s": 6.594215940769103,
    "mean_motion_rad_s": 0.0009720240027605133,
    "right_ascension_deg": 229.99999985076553,
    "declination_deg": 0.0017364817681202087
  }
}
