{
  "id": "orbital_elements_kepler_e0p5_ta30_132",
  "category": "orbital_elements",
  "case_version": "0.1.0",
  "generated_by": {
    "tool": "GMAT",
    "tool_version": "R2026a",
    "tool_sha256": "fe124b4a606b2e3b704a6fbb1c37b87598d5df0d18cb661c304b5f60074a7754",
    "kernel": "none (two-body conversion)",
    "date": "2026-10-25",
    "method": "GMAT Delaunay state (l = M, g = AOP, h = RAAN, L, G, H from a, e, i at 60 digits) entered with the case numbers, Earth.Mu = gm_km3_s2; Cartesian state reported in EarthMJ2000Eq",
    "reference_frame": "EarthMJ2000Eq (axes of the input numbers; the conversion does not depend on them)",
    "script": "orbital_elements_kepler_e0p5_ta30_132.script",
    "log": "orbital_elements_kepler_e0p5_ta30_132.log"
  },
  "outputs": {
    "position_km": [
      -1661.9566308253657,
      5423.310287779021,
      4638.293378417348
    ],
    "velocity_km_s": [
      -8.466818612183658,
      -2.190334568692885,
      1.9605763652286643
    ]
  }
}
