{
  "id": "frame_transformation_itrf93_inverse_007",
  "category": "frame_transformation",
  "case_version": "0.1.0",
  "generated_by": {
    "tool": "GMAT",
    "tool_version": "R2026a",
    "tool_sha256": "fe124b4a606b2e3b704a6fbb1c37b87598d5df0d18cb661c304b5f60074a7754",
    "kernel": "data/: de440s.bsp (SHA-256 c1c7feeab882263fc493a9d5a5b2ddd71b54826cdf65d8d17a76126b260a49f2), earth_latest_high_prec.bpc (SHA-256 3f6ce47a0a5cdf65bfb29d560bf5a39793f21001b128af0e376415cb79cbe549), moon_080317.tf (SHA-256 78732477b96f9863e7b0d65bcee3c22b8707ca5ed0db56d1173319cb2e8c7993), moon_pa_de421_1900-2050.bpc (SHA-256 656f90616403d75a75f0cd6c8830fc5b44f8cb4facb5ccb8915e752b397520cf), pck00011.tpc (SHA-256 3dff7b1dbeceaa01f25467767d3fa25816051c85d162d1edf04acb310ee28bb1)",
    "date": "2026-10-25",
    "method": "State entered in the GMAT coordinate system of ITRF93 about Earth, reported in one with Axes = SPICE (or ICRF) for ICRF about Earth; kernels of data/, no custom Planet, data/ bpc loaded last (log checked); cross-checked against CSPICE sxform and spkezr",
    "reference_frame": "EarthICRF (Axes = ICRF, origin Earth)",
    "script": "frame_transformation_itrf93_inverse_007.script",
    "log": "frame_transformation_itrf93_inverse_007.log"
  },
  "outputs": {
    "position_km": [
      7035.7372398120515,
      715.8783863011921,
      485.7155838025816
    ],
    "velocity_km_s": [
      -0.25815753581956424,
      7.727330918074612,
      1.100437001161789
    ]
  }
}
